{"request_id":"tst:wf-request:referencecity-s010","workflow_id":"tst:workflow:referencecity-plan-lifecycle","instance_id":"tst:wf-instance:referencecity-plan0001","subject_ref":"RC:PLAN:0001","actor_ref":"RC:ACTOR:001","action":"open_amendment","expected_version":"1","occurred_at":"2030-03-10T01:00:00Z","payload_digest":{"algorithm":"sha256","digest":"849510a70761d9d7deb647663c697009ac9cc4eb9cc79d83ef2e37ebfc9a7574","canonicalization":"RFC8785-JCS"},"authorization":{"decision_ref":"tst:authz:referencecity-s010","decision":"allow","granted_permissions":["plan.amend"]},"document_refs":[],"signature_refs":[],"rule_evaluations":[{"evaluation_ref":"tst:rule-evaluation:referencecity-s010","outcome":"pass"}],"schema_version":"0.5"}